{"contractVersion":"nest.worker.v1","taskRef":"task:formation-revise","worldRef":"world:alpha","taskKind":"FORMATION","generation":2,"executionStatus":"COMPLETED","resultType":"WRITE_SET","writeSet":[{"action":"REVISE","sourceAnchors":[{"sourceRef":"source:fixture-1","sourceVersion":"source-v2","locator":"fixture-locator"}],"type":"CLAIM","content":"fixture content revise","conditions":[],"subject":"fixture-subject","scope":"fixture-scope","perspective":"fixture-perspective","uncertainty":"fixture-uncertainty","supporting":["revision:source-2"],"counterExamples":[],"expectedCurrent":{"memoryId":"memory:decision-1","revisionId":"revision:current-1"}}]}
