{"contractVersion":"nest.worker.v1","taskRef":"task:formation-create","worldRef":"world:alpha","taskKind":"FORMATION","generation":2,"executionStatus":"COMPLETED","resultType":"WRITE_SET","writeSet":[{"action":"CREATE","sourceAnchors":[{"sourceRef":"source:fixture-1","sourceVersion":"source-v1","locator":"fixture-locator-a"},{"sourceRef":"source:fixture-1","sourceVersion":"source-v1","locator":"fixture-locator-c"}],"type":"UNDERSTANDING","content":"fixture content create","conditions":["fixture-condition"],"subject":"fixture-subject","scope":"fixture-scope","perspective":"fixture-perspective","uncertainty":"fixture-uncertainty","supporting":["revision:source-1"],"counterExamples":[]}]}
